{
  "evidence_id": "01912345-6789-7abc-9def-0123456789ab",
  "project_id": "01912345-6789-7abc-9def-0123456789ac",
  "type": "image",
  "sha256": "e3b0c44298fc1c149afbf4c8996fb92427ae41e4649b934ca495991b7852b855",
  "mime_type": "image/jpeg",
  "journey_stage": "act",
  "captured_at": "2026-09-07T10:00:00Z",
  "processing_status": "QUARANTINED",
  "metadata": { "note": "READY 之外的状态不得出现在 job payload 的 evidence 清单中——由 Go 构造 payload 时过滤；schema 本身不禁止（清单内合法枚举），此文件仅用于人工对照" }
}
